Date,Stars,Review
2025-12-23,5,"This phone is straight fire 🔥 runs super smooth and battery lasts forever."
2025-12-24,2,"Yeahhhh this ain't it. Laggy and overpriced. Hard pass."
2025-12-25,4,"Pretty solid phone tbh. Does what I need without drama."
2025-12-26,1,"Stopped working in like 3 days. Love that for me 🙃"
2025-12-27,5,"Camera is insane. Like actually shocked how good it is."
2025-12-28,3,"It's mid. Not bad, not great, just... there."
2025-12-29,4,"Good value for the price. No complaints so far."
2025-12-30,2,"Battery dies way too fast. Kinda annoying ngl."
2025-12-31,5,"Best phone I've had in years. Easy recommend."
2026-01-01,3,"Works fine but nothing special honestly."
2026-01-02,4,"Smooth performance and nice design. I'm into it."
2026-01-03,1,"Crashes constantly. Super frustrating."
2026-01-04,5,"This thing is a beast. Fast, clean, love it."
2026-01-05,2,"Customer support ghosted me lol cool cool."
2026-01-06,3,"It's okay. Gets the job done I guess."
2026-01-07,4,"Really liking it so far. No major issues."
2026-01-08,5,"Battery life is elite. Finally!"
2026-01-09,1,"Touchscreen barely works. Great design choice 👍"
2026-01-10,3,"Kinda buggy but manageable."
2026-01-11,4,"Nice phone overall. Would buy again."
2026-01-12,2,"Feels cheap and slow. Not impressed."
2026-01-13,5,"Absolutely love it. Worth every penny."
2026-01-14,3,"Average phone. Nothing crazy."
2026-01-15,4,"Good mix of features and price."
2026-01-16,1,"Worst phone I've owned. Period."
2026-01-17,5,"Super fast and clean UI. Big fan."
2026-01-18,2,"Overheats like crazy. Not ideal."
2026-01-19,3,"Decent but has some quirks."
2026-01-20,4,"Pretty reliable so far."
2026-01-21,5,"No complaints at all. Solid device."
2026-01-22,2,"Why is it so slow tho??"
2026-01-23,4,"Good phone for everyday use."
2026-01-24,3,"It's fine. Just fine."
2026-01-25,5,"Honestly exceeded expectations."
2026-01-26,1,"Completely unusable after update. Nice."
2026-01-27,4,"Works great for the price."
2026-01-28,3,"Battery could be better."
2026-01-29,5,"Love everything about it."
2026-01-30,2,"Not worth the hype at all."
2026-01-31,4,"Pretty happy with this purchase."
2026-02-01,3,"It's alright. Nothing amazing."
2026-02-02,5,"Super impressed. Great job Megatelco."
2026-02-03,1,"Broke within a week. Unreal."
2026-02-04,4,"Nice design and smooth feel."
2026-02-05,2,"Glitchy and annoying."
2026-02-06,5,"Fast, sleek, powerful. Love it."
2026-02-07,3,"Could be better tbh."
2026-02-08,4,"Does everything I need."
2026-02-09,1,"Screen froze constantly. Fun times."
2026-02-10,5,"Amazing phone. No regrets."
2026-02-11,3,"It's okay. Kinda meh."
2026-02-12,4,"Good performance overall."
2026-02-13,2,"Too many bugs for me."
2026-02-14,5,"Fantastic device. Highly recommend."
2026-02-15,3,"Average experience."
2026-02-16,4,"Pretty solid all around."
2026-02-17,1,"Horrible experience. Avoid."
2026-02-18,5,"Absolutely love this thing."
2026-02-19,2,"Disappointed honestly."
2026-02-20,4,"Nice upgrade from my old phone."
2026-02-21,3,"It's decent I guess."
2026-02-22,5,"Best purchase this year."
2026-02-23,1,"Total waste of money."
2026-02-24,4,"Works great for me."
2026-02-25,2,"Laggy and frustrating."
2026-02-26,5,"Super smooth and fast."
2026-02-27,3,"Nothing special."
2026-02-28,4,"Good quality overall."
2026-03-01,1,"Stopped working randomly. Cool."
2026-03-02,5,"Love it so much."
2026-03-03,3,"It's fine."
2026-03-04,4,"Pretty good device."
2026-03-05,2,"Not impressed."
2026-03-06,5,"Amazing performance."
2026-03-07,3,"Average at best."
2026-03-08,4,"Solid choice."
2026-03-09,1,"Terrible experience."
2026-03-10,5,"Absolutely fantastic."
2026-03-11,2,"Would not recommend."
2026-03-12,4,"Happy with it."
2025-12-01,4,"I purchased a Megatelco phone last week, and it has sick performance. The camera quality is great, and the battery life is long. Overall, a solid 4-star experience."
2025-12-03,3,"My Megatelco phone arrived fast, but I've noticed some issues with the software. It tends to lag at times, affecting the user experience. Customer support was helpful, but I expected better performance. 3 stars."
2025-12-05,5,"Megatelco offers top-notch phones! I'm happy with the features and the smooth interface. The camera takes stunning photos, and the battery lasts all day. 5 stars without a doubt!"
2025-12-08,4,"I've been using Megatelco phones for a while now, and they never disappoint. The latest model I purchased is no exception. Great performance, stylish design, and excellent customer service. 4 stars from a satisfied customer."
2025-12-10,2,"Regrettably, my experience with Megatelco was not as expected. The phone had constant connectivity issues, and the support team couldn't provide a solution. Disappointed and only giving it 2 stars."
2025-12-12,3,"Megatelco's latest phone is so so. It has some good features but is overpriced. The customer service team was quick to address a minor concern I had. I'll give it a 3-star rating."
2025-12-15,3,"I had a mixed experience with Megatelco. The phone's performance is decent, but I encountered some software glitches. Customer support was responsive but couldn't entirely resolve the issue. 3 stars."
2025-12-18,4,"Megatelco phones are reliable and have good prices. I especially like the new iPhone model. I'm giving it 4 stars for its overall quality."
2025-12-20,1,"My Megatelco phone started malfunctioning within a week of purchase. The touch screen wouldn't respond, and customer support was unable to provide a quick solution. Unfortunately, a 1-star rating."
2025-12-22,5,"I recently upgraded to the latest Megatelco phone, and it's fantastic! The speed, camera quality, and battery life are exceptional. The sleek design is a bonus. Easy 5 stars!"
